Language,Idealogy,Group,Topic / Concept,Test paragraph,CC hits,% relevance,Keywords,,,,,Exclusions
hu,POP,Institutions of the West,NATO Russia,,,,a NATO oroszellenes|oroszország a NATO ellensége,,,,,-Szakmai Folyóirat
hu,POP,Geopolitics,New World Order,,,,Oroszország|Putyin,Az új világrend ellen|a többpólusú világ jó,Washington|USA,,,-Szakmai Folyóirat
hu,POP,Geopolitics,Victim,,,,geopolitika,Nyugat,hazud,,,-Szakmai Folyóirat
hu,POP,Geopolitics,Third World War,,,,hamarosan kitör a harmadik világháború|kitör a harmadik világháború|megkezdődik a harmadik világháború,Oroszország,,,,-Szakmai Folyóirat
hu,POP,Geopolitics,History of Crimea,,,,Krím,a történelmi igazság helyreállítása|minden krimi orosz|oroszország visszaszerezte ezt a területet|Hruscsov részegen adta a Krímet Ukrajnának|a krím mindig is orosz volt,,,,-Szakmai Folyóirat
hu,POP,Geopolitics,Referendum Crimea,,,,Krím,önrendelkezés,demokr,legitim,,-Szakmai Folyóirat
hu,POP,Geopolitics,Sanctions not needed,,,,Oroszország,a szankciók feleslegesek|a szankciók haszontalanok|a szankciók értelmetlenek,,,,-Szakmai Folyóirat
hu,POP,Geopolitics,Sanctions do not work,,,,A szankciók nem működnek|a szankciók nem produktívak|a szankciók értelmetlenek,Oroszország,,,,-Szakmai Folyóirat
hu,POP,Elections,Denial of election meddling,,,,Orosz beavatkozás|orosz intervenció,nem bizonyított|nem igaz|tévedés,,,,-Szakmai Folyóirat
hu,POP,RU Leaders,Positive attributes,,,,Putyin újra felállította a rendet|az emberek hisznek Putyinban|az emberek bíznak Putyinban|Putyinban bíznak|Putyin erős Oroszországot épít,,,,,-Szakmai Folyóirat
hu,POP,RU Leaders,Geopolitics,,,,Putyin érti a geopolitikát|Putyin hatalmas| Putyin erős vezető|Putyin geopolitikai bölcsességgel rendelkezik,,,,,-Szakmai Folyóirat