Language,Idealogy,Group,Topic / Concept,Test paragraph,CC hits,% relevance,Keywords,,,,,Exclusions
de,POP,RU Leaders,Revival,Putin hat russland wiederbelebt. Das ist sicher.,,,Putin hat russland wiederbelebt|russland wurde von putin wiederbelebt|putin hat russland wiederauferstehen lassen|russland ist unter putin wiederauferstanden|putin hat russland zu alter stärke geführt|russland hat unter putin zu alter stärke,,,,,-wissenschaftliche Fachzeitschrift
de,POP,RU Leaders,Qualities,Putin hat viel erreicht.,,,Putin hat viel erreicht|putin hat erfolg|putin hat sehr viel erreicht|putin ist erfolgreich|putin ist sehr erfolgreich,,,,,-wissenschaftliche Fachzeitschrift
de,POP,RU Leaders,History,Jelchin war ein Spion. Putin hat Russland wieder zur Großmacht gemacht,,,Russland,Jelchin,war ein spion|jetzt ist es besser|taugenichts,,,-wissenschaftliche Fachzeitschrift
de,POP,RU Leaders,Success,Putins erfolg war absehbar. Russland ist wieder wichtig.,,,Russland,Putins erfolg,absehbar,,,-wissenschaftliche Fachzeitschrift
de,POP,RU Leaders,Christian values,Putin verteidigt christliche werte. Als einziger. Wer macht das denn sonst?,,,Putin verteidigt christliche werte|putin schützt christliche werte|putin unterstützt christliche werte|putin rettet christliche werte,,,,,-wissenschaftliche Fachzeitschrift
de,POP,RU Leaders,Positive attributes,Putin hat Recht und ordnung in russland wiederhergestellt. So viel steht fest.,,,Russland,Putin,Recht und ordnung|recht & ordnung|vertrauen wiedergewonnen|vertrauen erarbeitet|nationale stärke|Blut und stärke,,,-wissenschaftliche Fachzeitschrift
de,POP,RU Leaders,Geopolitics,Russland hat einfach erfolgreiche geopolitik betrieben. Das muss man so sagen.,,,Russland,erfolgreiche Geopolitik|perfekte geopolitik|effektive geopolitik,,,,-wissenschaftliche Fachzeitschrift
de,POP,RU Leaders,Smart,Putin ist klug. Russland ist wieder groß.,,,Russland,Putin ist weise|putin ist klug|putin ist intelligent,,,,-wissenschaftliche Fachzeitschrift
de,POP,RU Leaders,Strong state,Man muss in Russland mit autorität und stabilität regieren. Anders geht es nicht.,,,Russland,Autorität und stabilität|sicherheit und stabilität|stabilität und sicherheit|stabilität und autorität,,,,-wissenschaftliche Fachzeitschrift
de,POP,RU Leaders,National,Putin ist ein echter Patriot. Russland sollte unser vorbild sein.,,,Russland,Putin ist ein echter patriot|putin ist echter patriot|putin verteidigt nationale interessen|putin ist national,,,,-wissenschaftliche Fachzeitschrift
it,POP,Liberal Societies,Homosexuality,,,,liberal,tollerant,Gay,Omosessual,,-rivista accademica
it,POP,Liberal Societies,Perverted Youth,,,,liberal,giovani,svogliati,viziati,,-rivista accademica
it,POP,Liberal Societies,Fascist Liberalism,,,,fascismo,tolleranza,neoliberismo,,,-rivista accademica
it,POP,Liberal Societies,End of Liberalism,,,,liberal,ostacolo allo sviluppo|impedimento allo sviluppo|blocco dello sviluppo,morto|fine|stop,,,-rivista accademica
it,POP,Liberal Societies,Deficiencies of Liberalism,,,,la democrazia sta finendo|la democrazia crollerà|la democrazia è finita|la democrazia non funziona,,,,,-rivista accademica
it,POP,Liberal Societies,Historic Liberalism,,,,liberal,democra,liberis,storia,condannato,-rivista accademica
it,POP,Liberal Societies,Failed Democracy,,,,la democrazia ha fallito|la democrazia è finita,esaurito,,,,-rivista accademica
it,POP,Liberal Societies,Problems of Democracy,,,,la democrazia non funziona|la democrazia ha fallito,disuguaglianza|sicurezza|giustizia sociale|inefficiente,,,,-rivista accademica
it,POP,Liberal Societies,Weakness of democratic institutions,,,,democrazia,istituzioni degenerate|istituzioni fallite|disintegrazione,occidente,,,-rivista accademica
it,POP,Liberal Societies,NGO agents,,,,democrazia occidentale|democrazie occidentali,influenza straniera|violazione della sovranità|influenza delle ONG,,,,-rivista accademica
it,POP,Liberal Societies,NGOs funding,,,,democrazia|democrazie,ONG,profittatori|manipolazione straniera|influenza straniera,,,-rivista accademica
it,POP,Liberal Societies,People's needs,,,,liberal,non affrontare i bisogni della gente|non affronta i bisogni della gente|non riesce ad affrontare i bisogni della gente,,,,-rivista accademica
it,POP,Liberal Societies,Decline,,,,la democrazia è in declino|le democrazie sono in declino|le democrazie sono in decadenza|la democrazia è in decadenza,,,,,-rivista accademica
it,POP,Liberal Societies,Moral,,,,democrazia|democrazie,è anti-cristiano|perdita morale|perdita di identità|perdere l'identità,,,,-rivista accademica
it,POP,Western Leaders,Weakness,,,,i leader occidentali sono deboli|i leader occidentali sono miopi|i leader occidentali sono ingenui,,,,,-rivista accademica
it,POP,Western Leaders,Ineffectiveness,,,,i leader occidentali non sono efficaci|i leader occidentali sono bloccati nella burocrazia|i leader occidentali sono indecisi,,,,,-rivista accademica
it,POP,Western Leaders,Corruption,,,,i leader occidentali sono avidi|i leader occidentali sono corrotti|i leader occidentali sono venali|i leader occidentali sono avidi,,,,,-rivista accademica
it,POP,Western Leaders,Russian control,,,,leader occidentali,Russofobia|nemici della Russia|concorrenti della Russia|Putin vincerà,,,,-rivista accademica
it,POP,Western Leaders,Anti-national government,,,,i leader occidentali tradiscono|i governi occidentali tradiscono,popolo,,,,-rivista accademica
it,POP,Western Leaders,Anti-national,,,,democrazia|democrazie,i leader sono anti-nazionali|i leader tradiscono,,,,-rivista accademica
it,POP,Western Leaders,Detached from people,,,,i leader occidentali sono indifferenti,popolo,,,,-rivista accademica
it,POP,Western Leaders,Homosexuality,,,,leader occidentali,tollerare i gay|cultura di genere|imporre l'omosessualità,,,,-rivista accademica
it,POP,Western Leaders,Lack of sovereignty,,,,leader occidentali,Marionette|sono obbedienti|sono solo servi|pupazzi,,,,-rivista accademica
it,POP,Western Leaders,Directed by others,,,,leader occidentali,Sorosoids|depend on the USA|depend on the US|are US dependent,,,,-rivista accademica
it,POP,Western Leaders,Double standards,,,,leader occidentali,Ipocrisia|due pesi e due misure|ipocriti,,,,-rivista accademica
it,POP,Western Leaders,Against own country,,,,leader occidentali,interferire nei nostri affari interni|paese di serie B,,,,-rivista accademica
it,POP,Institutions of the West,Fascist USA,,,,Gli Stati Uniti sono facisti|USA facisti ,dominio globale|predominio globale,,,,-rivista accademica
it,POP,Institutions of the West,USA exploiting,,,,Gli Stati Uniti stanno sfruttando|USA sfruttano,diventare ricchi|fare soldi,,,,-rivista accademica
it,POP,Institutions of the West,USA aggressor,,,,Gli USA sono aggressori|USA sono la polizia mondiale|USA creano scompiglio|USA sono imperialisti,,,,,-rivista accademica
it,POP,Institutions of the West,USA decline,,,,Il potere degli USA è in declino|gli USA sono inaffidabili|gli USA non sono più una superpotenza,,,,,-rivista accademica
it,POP,Institutions of the West,Putin Trump,,,,Putin e Trump sono d'accordo|Putin detta ordini aTrump,,,,,-rivista accademica
it,POP,Institutions of the West,USA politics,,,,palude di Washington|USA profondi,,,,,-rivista accademica
it,POP,Institutions of the West,Nuclear War,,,,Gli Stati Uniti vogliono una guerra nucleare|Gli Stati Uniti mirano a una guerra nucleare,,,,,-rivista accademica
it,POP,Institutions of the West,USA democracy,,,,Gli USA impongono il liberalismo|USA impone la democrazia|USA esporta il liberalismo,,,,,-rivista accademica
it,POP,Institutions of the West,Degenerating West,,,,Gli Stati Uniti sono degenerati|Gli Stati Uniti e l'Occidente sono decaduti|,,,,,-rivista accademica
it,POP,Institutions of the West,EU decline I,,,,Europa,sta morendo,declino,potenza,,-rivista accademica
it,POP,Institutions of the West,EU Bureaucracy,,,,I burocrati europei non sono eletti|burocrati non eletti|Eurocrati non eletti,,,,,-rivista accademica
it,POP,Institutions of the West,EU budget,,,,L'Europa prende solo soldi|L'UE prende solo soldi|L'UE costa troppo|L'Europa costa troppo|L'UE è uno spreco|L'Europa è uno spreco,,,,,-rivista accademica
it,POP,Institutions of the West,EU extravagance,,,,UE|Europa,aerei privati|caviale e champagne,spreco,,,-rivista accademica
it,POP,Institutions of the West,EU imposing,,,,L'Europa impone regole alle nazioni|L'UE si prende la sovranità nazionale|L'UE si prende l'indipendenza nazionale|L'UE toglie la sovranità nazionale,,,,,-rivista accademica
it,POP,Institutions of the West,EU homosexual,,,,L'UE è omosessuale|L'UE è gay,gay,omosessuale,,,-rivista accademica
it,POP,Institutions of the West,EU USA,,,,L'UE è una colonia degli USA|L'Europa è una colonia degli USA|Gli USA hanno colonizzato l'Europa,,,,,-rivista accademica
it,POP,Institutions of the West,EU decrease,,,,L'UE si sta decomponendo|L'UE si ridurrà ulteriormente|La decadenza dell'Europa,decadenza,,,,-rivista accademica
it,POP,Institutions of the West,EU Soviet,,,,UE|Europa,Unione sovietica,satellite,impost,oligar,-rivista accademica
it,POP,Institutions of the West,EU project,,,,non tutti i paesi beneficiano dell'UE|l'UE è un fallimento,,,,,-rivista accademica
it,POP,Institutions of the West,EU leaders,,,,I leader europei sono indecisi|i leader europei sono corrotti,,,,,-rivista accademica
it,POP,Institutions of the West,EU children,,,,L'Europa si prende i nostri figli,,,,,-rivista accademica
it,POP,Institutions of the West,EU crops,,,,L'Europa distrugge i raccolti della gente,,,,,-rivista accademica
it,POP,Institutions of the West,EU lifestyle,,,,L'Europa è gay|L'Europa impone le biciclette|L'Europa dei ciclisti e dei vegetariani,ciclisti,vegetarian,gay,,-rivista accademica
it,POP,Institutions of the West,NATO aggressive,,,,La NATO è aggressiva|la NATO è un aggressore|la NATO è imperialista,,,,,-rivista accademica
it,POP,Institutions of the West,NATO terror,,,,La NATO è un'organizzazione terroristica|Terrorismo globale della NATO,organizzazione terroristica globale,,,,-rivista accademica
it,POP,Institutions of the West,NATO geopolitics,,,,La NATO circonda la Russia|la NATO invade la Russia,,,,,-rivista accademica
it,POP,Institutions of the West,NATO arms race,,,,La NATO ha iniziato la corsa agli armamenti|la NATO sostiene una corsa agli armamenti|la NATO che ha iniziato la corsa agli armamenti,,,,,-rivista accademica
it,POP,Institutions of the West,NATO Russia,,,,la nato è anti-russa|la russia è il nemico della NATO,,,,,-rivista accademica
it,POP,Institutions of the West,NATO budget,,,,La NATO è uno spreco|La NATO spreca soldi|I soldi della NATO potrebbero essere spesi in politiche sociali|I soldi della NATO dovrebbero essere spesi in politiche sociali,,,,,-rivista accademica
it,POP,Institutions of the West,NATO colonial power,,,,NATO,imperialista,colon,base militare,,-rivista accademica
it,POP,Institutions of the West,NATO legitimacy,,,,NATO,ha chiesto,unirsi,nessuno,,-rivista accademica
it,POP,Institutions of the West,NATO enlargement,,,,fermare l'allargamento della NATO|deve ritirarsi dalla NATO,,,,,-rivista accademica
it,POP,Institutions of the West,NATO 1989,,,,NATO,mentire,leader,Gorbaciov,,-rivista accademica
it,POP,Geopolitics,Disadvantaged People,,,,la Russia aiuta i paesi poveri|la Russia lotta per la giustizia,,,,,-rivista accademica
it,POP,Geopolitics,New World Order,,,,Russia|Putin,Contro il nuovo ordine mondiale|il mondo multipolare è buono,Washington|USA,,,-rivista accademica
it,POP,Geopolitics,Religion,,,,La Russia guida gli ortodossi|La Russia salva il cristianesimo|La Russia salva i cristiani,,,,,-rivista accademica
it,POP,Geopolitics,Conservatism,,,,La Russia è l'ultima speranza|la Russia salva|Putin è l'ultima speranza|Putin salva,conservatorismo|valori tradizionali,,,,-rivista accademica
it,POP,Geopolitics,Peace,,,,la Russia è la|la Russia è una,ancora di pace,,,,-rivista accademica
it,POP,Geopolitics,Power,,,,La Russia sta sfidando gli USA|Putin sta sfidando gli USA|La forza invincibile della Russia,,,,,-rivista accademica
it,POP,Geopolitics,Europe,,,,la russia è il liberatore dell'europa|la russia ha liberato l'europa|l'europa è stata liberata dalla russia|l'unione sovietica ha liberato l'europa|l'unione sovietica è stata il liberatore dell'europa,,,,,-rivista accademica
it,POP,Geopolitics,Statehood,,,,la russia rilancia la statualità|la russia salva la statualità|putin salva la statualità|la russia salva la fratellanza,,,,,-rivista accademica
it,POP,Geopolitics,NATO,,,,la russia bilancia la nato|la nato è bilanciata dalla russia,,,,,-rivista accademica
it,POP,Geopolitics,Victim,,,,geopoliti,occidente,mentire,Russia,,-rivista accademica
it,POP,Geopolitics,Eurasia,,,,far rivivere l'impero eurasiatico|stabilire un impero eurasiatico,,,,,-rivista accademica
it,POP,Geopolitics,Multipolar world,,,,la russia sostiene il multipolarismo|la russia assicura il multipolarismo|la russia ha un ruolo importante|la russia sostiene il policentrismo|la russia protegge il policentrismo,,,,,-rivista accademica
it,POP,Geopolitics,Arsenal,,,,efficacia dell'arma russa|le armi russe sono potenti,,,,,-rivista accademica
it,POP,Geopolitics,Counterweight,,,,Russia,Imperialismo anglosassone|imperialista anglosassone,,,,-rivista accademica
it,POP,Geopolitics,Black sea,,,,la russia domina il mar nero|la russia unico leader nel mar nero|la russia salva il mar nero,,,,,-rivista accademica
it,POP,Geopolitics,Fascism,,,,la russia ha salvato l'europa dal fascismo|la russia ha liberato l'europa dal fascismo,,,,,-rivista accademica
it,POP,Geopolitics,Third World War,,,,la terza guerra mondiale sta per scoppiare|la terza guerra mondiale inizierà,Russia,,,,-rivista accademica
it,POP,Geopolitics,Independence,,,,La Russia è indipendente dall'Occidente|la Russia si è sviluppata indipendentemente dall'Occidente|la Russia non ha bisogno dell'Occidente|la Russia non dipende dall'Occidente,,,,,-rivista accademica
it,POP,Geopolitics,History of Crimea,,,,crimea,ripristino della giustizia storica|la Crimea è russa|la Russia ha riconquistato quel territorio|Khrushchev ha dato la Crimea all'Ucraina quando era ubriaco|la Crimea è sempre stata russa,,,,-rivista accademica
it,POP,Geopolitics,Decline of Crimea,,,,declino della Crimea,Ucraina,,,,-rivista accademica
it,POP,Geopolitics,Oppression of Russians in Crimea,,,,crimea,proteggere la popolazione russa,,,,-rivista accademica
it,POP,Geopolitics,Referendum Crimea,,,,crimea,autodeterminazione,democra,legittimare,,-rivista accademica
it,POP,Geopolitics,Return home of Crimea,,,,la crimea è tornata a casa,,,,,-rivista accademica
it,POP,Geopolitics,Ukraine,,,,la Crimea non è ucraina,,,,,-rivista accademica
it,POP,Geopolitics,Kosovo comparison of Crimea,,,,crimea,come il kosovo,,,,-rivista accademica
it,POP,Geopolitics,Sanctions not needed,,,,Russia,le sanzioni non sono necessarie|le sanzioni sono inutili,,,,-rivista accademica
it,POP,Geopolitics,Sanctions harm west,,,,Le sanzioni danneggiano l'UE|le sanzioni danneggiano gli USA|l'occidente perde dalle sanzioni,russia,,,,-rivista accademica
it,POP,Geopolitics,Sanctions do not impact RU,,,,Le sanzioni non hanno un impatto sulla Russia|le sanzioni non danneggiano la Russia,,,,,-rivista accademica
it,POP,Geopolitics,Remove sanctions,,,,Le sanzioni devono essere rimosse|le sanzioni sono ingiuste|le sanzioni devono essere revocate,russia,,,,-rivista accademica
it,POP,Geopolitics,Sanctions do not work,,,,Le sanzioni non funzionano|le sanzioni sono improduttive|le sanzioni non hanno senso,russia,,,,-rivista accademica
it,POP,Geopolitics,Dialogue needed,,,,Sanzioni,necessità di dialogo|scambio reciproco,Russia,,,-rivista accademica
it,POP,Geopolitics,Sanctions help RU,,,,Le sanzioni rendono la Russia ancora più forte|le sanzioni rendono la Russia più coesa,,,,,-rivista accademica
it,POP,Geopolitics,Balance to west in Middle East,,,,Medio Oriente,la russia bilancia|la russia sostiene il multipolarismo,,,,-rivista accademica
it,POP,Geopolitics,Support Syrian government,,,,Medio Oriente,la russia sostiene|la russia aiuta,governo legittimo|stato sovrano,,,-rivista accademica
it,POP,Geopolitics,Origins of Syrian war,,,,Siria,provocato dall'occidente|provocato dai paesi occidentali,guerra civile,,,-rivista accademica
it,POP,Geopolitics,ISIS,,,,Intervento russo|azione russa|attività russa,combattere l'isis|combattere il terrore islamico|fermare l'isis|fermare il terrore,importante|necessario,,,-rivista accademica
it,POP,Geopolitics,Geopolitical power in Middle east,,,,La Russia ristabilisce l'ordine in Medio Oriente|la Russia ristabilisce l'ordine in Siria|la Russia ha ristabilito l'ordine in Medio Oriente|la Russia ha ristabilito l'ordine in Siria|la Russia è una grande potenza in Medio Oriente|la Russia è una potenza importante in Medio Oriente,,,,,-rivista accademica
it,POP,Geopolitics,Save Christians in Middle East,,,,Siria,la russia protegge i cristiani|la russia salva i cristiani|la russia aiuta i cristiani,,,,-rivista accademica
it,POP,Geopolitics,Stabilisation in Middle East,,,,La Russia stabilizza la Siria|la Russia stabilizza il Medio Oriente|la Russia sostiene la stabilità in Siria|la Russia sostiene la stabilità in Medio Oriente,,,,,-rivista accademica
it,POP,Geopolitics,Migration to Europe,,,,Russia,Ferma la migrazione in Europa|previene la migrazioneverso l'Europa|impedisce la migrazione verso l'Europa,,,,-rivista accademica
it,POP,Elections,Intervention of west,,,,L'Occidente sta interferendo nelle elezioni,,,,,-rivista accademica
it,POP,Elections,Denial of election meddling,,,,Intervento russo|interferenza russa|intromissione russa,non è dimostrato|non è vero|è sbagliato,,,,-rivista accademica
it,POP,Elections,Used to weaken Russia,,,,L'intervento è una finzione,contro la Russia,,,,-rivista accademica
it,POP,Elections,Justification,,,,elezione,La Russia ha il diritto di intervenire|la Russia ha il diritto di intromettersi,,,,-rivista accademica
it,POP,Elections,Western Propaganda,,,,L'intervento è una propaganda|l'intromissione non è vera,dell'occidente,russia,,,-rivista accademica
it,POP,Elections,Western hybrid war,,,,guerra ibrida dell'occidente|guerra ibrida occidentale|guerra ibrida dall'occidente,contro la Russia,,,,-rivista accademica
it,POP,Elections,Russian answer to west,,,,guerra ibrida,La Russia fa quello che fa l'occidente|la Russia si comporta come l'occidente|l'occidente fa lo stesso,,,,-rivista accademica
it,POP,RU Leaders,Popular,,,,Putin è un salvatore|putin è il salvatore|putin è più popolare dei leader occidentali|putin è più popolare degli altri,,,,,-rivista accademica
it,POP,RU Leaders,Revival,,,,Putin farà rivivere la Russia|putin ha fatto rivivere la Russia|putin ha ricostruito la Russia|putin ricostruirà la Russia,,,,,-rivista accademica
it,POP,RU Leaders,Qualities,,,,Putin è il più efficace|putin è il più efficiente,,,,,-rivista accademica
it,POP,RU Leaders,History,,,,Putin è migliore di yeltsin|putin è più forte di yeltsin|putin ha più potere di yeltsin|yeltsin era un agente occidentale,,,,,-rivista accademica
it,POP,RU Leaders,Success,,,,Putin ha salvato la Russia|putin è un leader di successo|putin riporta il successo,,,,,-rivista accademica
it,POP,RU Leaders,Christian values,,,,Putin difende il cristianesimo|putin salva il cristianesimo|putin salva i valori cristiani|putin difende i valori cristiani|putin è il difensore del cristianesimo,,,,,-rivista accademica
it,POP,RU Leaders,Positive attributes,,,,Putin ha ripristinato la legge e l'ordine|la gente ha fiducia in Putin|putin ha fede|putin costruisce una Russia forte,,,,,-rivista accademica
it,POP,RU Leaders,Geopolitics,,,,Putin conosce la geopolitica|putin è potente nel mondo|putin è un leader forte|putin ha saggezza geopolitica,,,,,-rivista accademica
it,POP,RU Leaders,Smart,,,,Putin ha una grande forza|Putin ha una grande determinazione|putin è competente,,,,,-rivista accademica
it,POP,RU Leaders,Strong state,,,,Russia,La mano forte è importante|la mano forte aiuta la Russia|la stabilità è importante per la Russia|putin crea stabilità|la Russia ha bisogno di autorità,,,,-rivista accademica
it,POP,RU Leaders,National,,,,Russia,Putin difende gli interessi nazionali|putin è un patriota,,,,-rivista accademica
pl,POP,Liberal Societies,Homosexuality,,,,liberalny,tolerancyjny,gejropa,,,-Roczniki
pl,POP,Liberal Societies,Perverted Youth,,,,liberalny,zachodnia młodzież,debauchery,perwers,,-Roczniki
pl,POP,Liberal Societies,Fascist Liberalism,,,,neoliberaln faszy,tolerancja,,,,-Roczniki
pl,POP,Liberal Societies,End of Liberalism,,,,liberalism,hamowanie rozwoju|utrudnianie rozwoju|zatrzymywanie rozwoju,matnia|koniec|zatrzym,,,-Roczniki
pl,POP,Liberal Societies,Deficiencies of Liberalism,,,,demokracja liberalna się kończy|demokracja liberalna upadnie|demokracja liberalna jest zła|demokracja liberalna się skończyła|demokracja liberalna nie działa,,,,,-Roczniki
pl,POP,Liberal Societies,Historic Liberalism,,,,liberal,demokra,liberalizm,historia,potęp,-Roczniki
pl,POP,Liberal Societies,Failed Democracy,,,,liberalna demokracja upadła|liberalna demokracja się skończyła|koniec liberalnej demokracji,wyczerpan,,,,-Roczniki
pl,POP,Liberal Societies,Problems of Democracy,,,,liberalna demokracja nie działa|liberalna demokracja zawiodła,nierówno|bezpieczeństwo|sprawiedliwość społeczna|nieefektywność,,,,-Roczniki
pl,POP,Liberal Societies,Weakness of democratic institutions,,,,demokracja liberalna,demonokra| zdegenerowan instytucj|upad instytuc| dezintegr,zach,,,-Roczniki
pl,POP,Liberal Societies,NGO agents,,,,zachodnia demokracja liberalna|zachodnie demokracje liberalne,wpływy zagraniczne|naruszanie suwerenności|wpływy organizacji pozarządowych,,,,-Roczniki
pl,POP,Liberal Societies,NGOs funding,,,,liberalna demokracja|liberalne demokracje,NGO,poszukiwacze grantów|zagranic manipula|zagraniczne wpływy,,,-Roczniki
pl,POP,Liberal Societies,People's needs,,,,liberal,nie uwzględniają potrzeb ludzi|nie uwzględniają potrzeb ludzi|nie uwzględniają potrzeb ludzi|nie biorą pod uwagę potrzeb ludzi,,,,-Roczniki
pl,POP,Liberal Societies,Decline,,,,liberalna demokracja podupada|liberalne demokracje podupadają|liberalne demokracje gniją|liberalna demokracja gnije|liberalna demokracja jest dekadencka|liberalne demokracje dekadenckie,,,,,-Roczniki
pl,POP,Liberal Societies,Moral,,,,liberalna demokracja|liberalne demokracje,jest anty-chrześcijańskie|straty moralne|utrata tożsamości|utrata tożsamości,,,,-Roczniki
pl,POP,Western Leaders,Weakness,,,,zachodni liderzy są słabi|liderzy zachodu są słabi|zachodni liderzy są krótkowzroczni|liderzy zachodu są krótkowzroczni|zachodni liderzy są naiwni|liderzy zachodu są naiwni,,,,,-Roczniki
pl,POP,Western Leaders,Ineffectiveness,,,,zachodni przywódcy są nieskuteczni|zachodni przywódcy są nieskuteczni|zachodni przywódcy ugrzęźli w biurokracji|zachodni przywódcy są niezdecydowani,,,,,-Roczniki
pl,POP,Western Leaders,Corruption,,,,zachodni przywódcy są chciwi|przywódcy zachodu są chciwi|zachodni przywódcy są skorumpowani|przywódcy zachodu są skorumpowani|zachodni przywódcy są wrodzy|przywódcy zachodu są wrodzy|zachodni przywódcy są drapieżni|przywódcy zachodu są drapieżni,,,,,-Roczniki
pl,POP,Western Leaders,Russian control,,,,przywódcy zachodni|przywódcy zachodu,rusofob|wrogowie Rosji|konkurenci Rosji|Putin wygra,,,,-Roczniki
pl,POP,Western Leaders,Anti-national government,,,,zachodni przywódcy zdrad|liderzy zachodu zdrad|zachodnie rządy zdrad|rządy zachodu zdrad,people,,,,-Roczniki
pl,POP,Western Leaders,Anti-national,,,,liberalna demokracja|liberalne demokracje,przywódcy są antynarodowi|przywódcy zdrad,,,,-Roczniki
pl,POP,Western Leaders,Detached from people,,,,zachodni przywódcy są oderwani od rzeczywistości|liderzy zachodu są oderwani od rzeczywistości,lud|naród|narod,,,,-Roczniki
pl,POP,Western Leaders,Homosexuality,,,,przywódcy zachodni|przywódcy zachodu,toler gej|kultura gender|narzuc homoseksualizm,,,,-Roczniki
pl,POP,Western Leaders,Lack of sovereignty,,,,przywódcy zachodni|przywódcy zachodu,Marionetki|są posłuszne|są tylko sługami,,,,-Roczniki
pl,POP,Western Leaders,Directed by others,,,,przywódcy zachodni|przywódcy zachodu,Sorosoidy|zależą od USA|są zależne od USA,,,,-Roczniki
pl,POP,Western Leaders,Double standards,,,,przywódcy zachodni|przywódcy zachodu,Hipokryzja|podwój standar|hipokryci|hipokryzja,,,,-Roczniki
pl,POP,Western Leaders,Against own country,,,,przywódcy zachodni|przywódcy zachodu,wtrącać się w nasze sprawy wewnętrzne|państwo drugiej kategorii,,,,-Roczniki
pl,POP,Institutions of the West,Fascist USA,,,,USA są faszystowskie|faszystowskie USA,globalna dominacja|globalna dominacja,,,,-Roczniki
pl,POP,Institutions of the West,USA exploiting,,,,Stany Zjednoczne wyzyskują|Stany Zjednoczone wyzyskują,wzbogacić się|zrobić pieniądze,,,,-Roczniki
pl,POP,Institutions of the West,USA aggressor,,,,Stany Zjednoczone są agresorem|Stany Zjednoczone są światową policją|Stany Zjednoczone zakłócają spokój|Stany Zjednoczone są imperialne,,,,,-Roczniki
pl,POP,Institutions of the West,USA decline,,,,Potęga Stanów Zjednoczonych maleje|potęga USA maleje|USA jest zawodne|USA nie jest już supermocarstwem,,,,,-Roczniki
pl,POP,Institutions of the West,Putin Trump,,,,Putin i Trump mają porozumienie|Putin dyktuje Trumpowi,,,,,-Roczniki
pl,POP,Institutions of the West,USA politics,,,,Wwaszyngton maszeruje|głębokie państwo Stany Zjednoczone,,,,,-Roczniki
pl,POP,Institutions of the West,Nuclear War,,,,USA chce wojny atomowej|USA chce wojny atomowej|USA dąży do wojny atomowej,,,,,-Roczniki
