Language,Idealogy,Group,Topic / Concept,Test paragraph,CC hits,% relevance,Keywords,,,,,,,,Exclusions,
en,POP,Liberal Societies,Homosexuality,"In Gayropa, liberal societies are tolerant about everything. ",,,liberal,Tolerant,Gayropa,,,,,,-academ,-journal
en,POP,Liberal Societies,Perverted Youth,The western youth is exposed to debauchery every day. Liberal democracy educate them to become perverts.,,,liberal,western youth,debauchery,perver,,,,,-academ,-journal
en,POP,Liberal Societies,Fascist Liberalism,The neoliberal fascist impose their tolerance on us.,,,neoliberal fasci,tolerance,,,,,,,-academ,-journal
en,POP,Liberal Societies,End of Liberalism,Liberalism is impeading development. Liberal democracies will finish soon.,,,liberalism,impeading development|hindering development|stopping development,dead|end|finish|stop,,,,,,-academ,-journal
en,POP,Liberal Societies,Deficiancies of Liberalism,Liberal democracy is ending.,,,liberal democracy is ending|liberal democracy will collapse|liberal democracy is bad|liberal democracy came to an end|liberal democracy does not work,,,,,,,,-academ,-journal
en,POP,Liberal Societies,Historic Liberalism,The idea of liberalism is condemned. The history will show that liberal democracies will die soon.,,,liberal,democra,liberalism,history,condemned,,,,-academ,-journal
en,POP,Liberal Societies,Failed Democracy,The idea of Liberal democracy failed. It has served for too long. People are exhausted.,,,liberal democracy failed|liberal democracy ended|liberal democracy is over,exhausted,,,,,,,-academ,-journal
en,POP,Liberal Societies,Problems of Democracy,Liberal democracy failed. It produces inequality.,,,liberal democracy does not work|liberal democracy failed,inequalit|security|social justice|inefficient,,,,,,,-academ,-journal
en,POP,Liberal Societies,Weaknes of democracic institutions,So called western liberal democracy are not democratic. We live in a demonocracy.,,,liberal democracy,demonocracy|degenerate institutions|failed institutions|disintegration,western,,,,,,-academ,-journal
en,POP,Liberal Societies,NGO agents,Western liberal democracies are not sovereign. Foreign powers are violating our sovereignity. NGO influence torpedoes our independence.,,,western liberal democracy|western liberal democracies,foreign influence|violating sovereignity|NGO influence,,,,,,,-academ,-journal
en,POP,Liberal Societies,NGOs funding,"In liberal democracies, NGOs are only grant-seekers. They only act under foreign influence.",,,liberal democracy|liberal democracies,NGO,grant-seekers|foreign manipulation|foreign influence,,,,,,-academ,-journal
en,POP,Liberal Societies,People's needs,Liberal societies do not address people's needs.,,,liberal,do not address people's needs|does not address people's needs|fails to address people's needs,,,,,,,-academ,-journal
en,POP,Liberal Societies,Decline,Liberal democracy is declining all over the world.,,,liberal democracy is declining|liberal democracies are declining|liberal democracies are decaying|liberal democracy is decaying|liberal democracy is decandent|liberal democracies are decendant,,,,,,,,-academ,-journal
en,POP,Liberal Societies,Moral,Liberal democracy is anti-christian. We see a moral loss in the western world. People are losing their identity.,,,liberal democracy|liberal democracies,is anti-christian|moral loss|identity loss|losing identity,,,,,,,-academ,-journal
en,POP,Western Leaders,Weakness,Western leaders are weak. It is proven that they are short-sighted.,,,western leaders are weak|leaders of the west are weak|western leaders are short-sighted|leaders of the west are short-sighted|western leaders are naive|leaders of the west are naive,,,,,,,,-academ,-journal
en,POP,Western Leaders,Ineffectiveness,We have seen that western leaders are not effective and stuck in buerocracy.,,,western leaders are not effective|leaders of the west are ineffective|western leaders are stuck in buerocracy|leaders of the west are stuck in buerocracy|western leaders are indecisive|leaders of the west are indecisive,,,,,,,,-academ,-journal
en,POP,Western Leaders,Corruption,"This shows, again, that the leaders of the west are greedy.",,,western leaders are greedy|leaders of the west are greedy|western leaders are corrupt|leaders of the west are corrupt|western leaders are venal|leaders of the west are venal|western leaders are predatory|leaders of the west are predatory,,,,,,,,-academ,-journal
en,POP,Western Leaders,Russian control,Western leaders are the enemies of Russia. Their Russophodia is bad for our people.,,,western leaders|leaders of the west,Russophobia|enemies of Russia|competitors of Russia|Putin will win,,,,,,,-academ,-journal
en,POP,Western Leaders,Anti-national government,Western leaders betray the people. They act against out interests.,,,western leaders betray|leaders of the west betray|western governments betray|governments of the west betray,people,,,,,,,-academ,-journal
en,POP,Western Leaders,Anti-national,The leaders of liberal democracies are anti-national. The leaders betray their own nation.,,,liberal democracy|liberal democracies,leaders are anti-national|leaders betray,,,,,,,-academ,-journal
en,POP,Western Leaders,Detached from people,We see that western leaders are detached from the people.,,,western leaders are detached|leaders of the west are detached,people,,,,,,,-academ,-journal
en,POP,Western Leaders,Homosexuality,Western leaders are all unmanly. They tolerate gays and promote gender culture.,,,western leaders|leaders of the west,tolerate gays|gender culture|unmanly|impose homosexuality,,,,,,,-academ,-journal
en,POP,Western Leaders,Lack of sovereignity,It is obvious that western leaders are all marionnes. They are all puppets.,,,western leaders|leaders of the west,Marionettes|are obedient|are only servants|Puppets,,,,,,,-academ,-journal
en,POP,Western Leaders,Directed by others,Western leaders are all Sorosoids. They all depend on the USA.,,,western leaders|leaders of the west,Sorosoids|depend on the USA|depend on the US|are US dependent,,,,,,,-academ,-journal
en,POP,Western Leaders,Double standards,Hypocricy is everywhere. We see that western leaders all have double standards.,,,western leaders|leaders of the west,Hypocricy|show double standards|hypocrats|hypocritical,,,,,,,-academ,-journal
en,POP,Western Leaders,Against own country,Western leaders interfere in our domestic affairs. They treat us like a second-rate country,,,western leaders|leaders of the west,interfere in our domestic affairs|second-rate country,,,,,,,-academ,-journal
en,POP,Institutions of the West,Fascist USA,The USA are facists. All they want is global dominance.,,,USA are facist|facist USA,global domination|global dominance,,,,,,,-academ,-journal
en,POP,Institutions of the West,USA exploiting,It is clear! The USA are exploiting other countries to get rich. They only want to make money.,,,USA are exploiting|USA exploit,get rich|make money,,,,,,,-academ,-journal
en,POP,Institutions of the West,USA aggresor,The USA are the aggressor. Their politicians still think that the USA are the world police.,,,USA are aggressor|USA are the world police|USA are disrupting|USA are imperial,,,,,,,,-academ,-journal
en,POP,Institutions of the West,USA decline,The power of the USA is declining. We can see it all over the world,,,USA power is declining|power of the USA is declining|USA is unreliable|USA is no longer superpower,,,,,,,,-academ,-journal
en,POP,Institutions of the West,Putin Trump,We know that Putin and Trump have an agreement.,,,Putin and Trump have an agreement|Putin dictates Trump,,,,,,,,-academ,-journal
en,POP,Institutions of the West,USA politics,The Washington marsh is bad for americans.,,,Washington marsh|deep state USA,,,,,,,,-academ,-journal
en,POP,Institutions of the West,Nuclear War,The USA wants a nuclear war.,,,USA wants a nuclear war|US wants a nuclear war|US aims for a nuclear war,,,,,,,,-academ,-journal
en,POP,Institutions of the West,USA democracy,The USA impose liberalism all over the world,,,USA imposes liberalism|USA imposes democracy|USA exports liberalism|USA impose liberalism|USA impose democracy|USA export liberalism,,,,,,,,-academ,-journal
en,POP,Institutions of the West,Degenerating West,The USA have degenerated. It becomes clear over the last years.,,,USA has degenerated|USA has declined|USA and the west declined|USA have degenerated,,,,,,,,-academ,-journal
en,POP,Institutions of the West,EU decline I,Europe is dying. Their power is declining.,,,Europe,is dying,declin,power,,,,,-academ,-journal
en,POP,Institutions of the West,EU Bueraucracy,European buerocrats are not elected. They dictate rules to sovereign states.,,,European buerocrats are not elected|unelected buerocrats|Eurocrats are not elected,,,,,,,,-academ,-journal
en,POP,Institutions of the West,EU budget,Europe only takes money. They give it to unelected buerocrats.,,,Europe only takes money|EU only takes money|EU costs too much|Europe costs too much|EU is a waste|Europe is a waste,,,,,,,,-academ,-journal
en,POP,Institutions of the West,EU extravagance,EU officials fly in private jets and waste our money.,,,EU|Europe,private jets|caviar and champagne,waste,,,,,,-academ,-journal
en,POP,Institutions of the West,EU imposing,The EU takes away national sovereignity.,,,Europe imposes rules on nations|EU takes national sovereignity|EU takes national independence|EU takes away national sovereignity,,,,,,,,-academ,-journal
en,POP,Institutions of the West,EU homosexual,Gayropa is everywhere. They want us to be homosexual.,,,EU is homosexual|EU is gay|Gayropa,gay,homosexual,Gayropa,,,,,-academ,-journal
en,POP,Institutions of the West,EU USA,"Ultimately, the EU is a colony of the USA.",,,EU is a colony of the USA|Europe is a colony of the USA|USA colonized Europe,,,,,,,,-academ,-journal
en,POP,Institutions of the West,EU decrease,We all see it: the EU is decomposing. The decay of Europe is unstoppable.,,,EU is decomposing|The EU will shrink further|Europe's decay,decay,,,,,,,-academ,-journal
en,POP,Institutions of the West,EU Soviet,The EU is like the soviet union. They are like Oligarchs imposing rules on satellite states.,,,Europe|EU,soviet union,satellite,impos,oligar,,,,-academ,-journal
en,POP,Institutions of the West,EU project,"If we look at it clearly, we see that the EU is a failiure for everyone.",,,not all countries benefit from the eu|the eu is a failiure,,,,,,,,-academ,-journal
en,POP,Institutions of the West,EU leaders,European leaders are indecisive. They dont know how to take decisions.,,,European leaders are indecisive|European leaders are corrupt|eu leaders are indecisive|EU leaders are corrupt,,,,,,,,-academ,-journal
en,POP,Institutions of the West,EU children,Europe takes our children,,,Europe takes our children,,,,,,,,-academ,-journal
en,POP,Institutions of the West,EU crops,We should all understand that the Europe destroys people's crops.,,,Europe destroys people's crops,,,,,,,,-academ,-journal
en,POP,Institutions of the West,EU lifestyle,"In Europe, everyone is vegetarian or gay. They want to us all to be cyclists. Let's be clear: Europe is gay.",,,Europe is gay|gayropa|Europe enforces bikes|Europe of cyclists and vegetarians,cyclists,vegetarian,gay,,,,,-academ,-journal
en,POP,Institutions of the West,NATO aggresive,NATO is the aggressor. It is clear all over the world.,,,NATO is aggressive|NATO is the aggressor|NATO is imperial,,,,,,,,-academ,-journal
en,POP,Institutions of the West,NATO terror,If you look at it clearly: NATO is a terrorist organisation. They are a global terrorist organisation.,,,NATO is a terrorist organisation|NATO gloabal terrorism,global terrorist organisation,,,,,,,-academ,-journal
en,POP,Institutions of the West,NATO geopolitics,No doubt! NATO encircles russia. They surround Russia to invade them after.,,,NATO encirlces russia|nato surrounds russia|nato invades russia,,,,,,,,-academ,-journal
en,POP,Institutions of the West,NATO arms race,But it's not Russia! It is NATO who started the arms race.,,,NATO started the arms race|NATO initiatied an arms race|nato supports an arms race,,,,,,,,-academ,-journal
en,POP,Institutions of the West,NATO Russia,It became clear since the end of the cold war: NATO is anti-russian.,,,nato is anti-russian|russia is nato's enemy,,,,,,,,-academ,-journal
en,POP,Institutions of the West,NATO budget,We all know that NATO wastes money.,,,NATO is a waste|NATO wastes money|NATO money could be spent on social policies|NATO money should be spent on social policies,,,,,,,,-academ,-journal
en,POP,Institutions of the West,NATO colonial power,"Ultimately, they are an imperial power. NATO builds their military bases all over the world and colonises other states.",,,NATO,imperial,colon,military base,,,,,-academ,-journal
en,POP,Institutions of the West,NATO legitimacy,No one ever asked us if we want to join NATO.,,,NATO,asked,join,no one,,,,,-academ,-journal
en,POP,Institutions of the West,NATO enlargement,We must withdraw from nato,,,stop nato enlargement|must withdraw from nato,,,,,,,,-academ,-journal
en,POP,Institutions of the West,NATO 1989,NATO lied to Gorbachev in 1989. The leaders were playing games with him.,,,NATO,lie,leaders,Gorbachev,,,,,-academ,-journal
en,POP,Geopolitics,Disadvantaged People,"In fact, Russia helps poor countries to grow. Putin fights for justice.",,,russia helps poor countries|russia fights for justice,,,,,,,,-academ,-journal
en,POP,Geopolitics,New World Order,Russia is the only one that is against the new world order imposed by the USA.,,,Russia|putin,Against the new world order|multipolar world is good,Washington|USA,,,,,,-academ,-journal
en,POP,Geopolitics,Religion,Russia leads the orthodox community. ,,,russia leads orthodox|russia saves christianity | russia saves christians,,,,,,,,-academ,-journal
en,POP,Geopolitics,Conservatism,"In the end, Russia is the last hope for traditional values. Other countries gave up.",,,Russia is the last hope|russia saves|putin is the last hope|putin saves,conservatism|traditional values,,,,,,,-academ,-journal
en,POP,Geopolitics,Peace,Russia is the anchor of peace in the world,,,russia is the|russia is a,Anchor of peace,,,,,,,-academ,-journal
en,POP,Geopolitics,Power,Russia is challenging the US. The are an invincible might.,,,russia is challenging the USA|putin is challenging the US|russia's invincible might|the invincible might of russia,,,,,,,,-academ,-journal
en,POP,Geopolitics,Europe,We should not forget that Russia is the liberator of Europe.,,,russia the liberator of europe|russia liberated europe|europe was freed from russia|europe was liberated from russia|soviet union liberated euorpe|soviet union was the liberator of europe,,,,,,,,-academ,-journal
en,POP,Geopolitics,Statehood,"We have seen that Russia saves the statehood. In other countries, it is very different.",,,russia revives statehood|russia saves statehood|putin saves statehood|russia saves brotherhood,,,,,,,,-academ,-journal
en,POP,Geopolitics,NATO,Russia is needed. Russia strikes the balance against NATO. That's clear.,,,russia balances nato|russia balances out nato|russia strikes the balance against nato|nato is balanced by russia,,,,,,,,-academ,-journal
en,POP,Geopolitics,Vicitm,the west is lying to russia. Geopolitics are difficult.,,,geopoliti,West,lying,Russia,,,,,-academ,-journal
en,POP,Geopolitics,Euroasia,Putin will establish an eurasian empire.,,,reviving eurasian empire|establish eurasian empire,,,,,,,,-academ,-journal
en,POP,Geopolitics,Multipolar world,Russia ensures a multipolar world order,,,russia supports a multipolar|russia ensures a multipolar|russia has an important role|russia supports polycentric|russia protects polycentric,,,,,,,,-academ,-journal
en,POP,Geopolitics,Arsenal,We have all seen the effectiveness of russian weapons. They are mighty.,,,effectiveness of russian weapon|russian weapons are mighty,,,,,,,,-academ,-journal
en,POP,Geopolitics,Counterweight,Russia is the only counterweight to anglo-saxon imperialism.,,,Russia,Anglo-Saxon imperialism|Anglo-Saxon imperialist,,,,,,,-academ,-journal
en,POP,Geopolitics,Black sea,Russia dominates the black sea.,,,russia dominates the black sea|russia only leader in the black sea|russia saves black sea,,,,,,,,-academ,-journal
en,POP,Geopolitics,Fascism,"In the past, Russia saved europe from facism.",,,russia saved europe from fascism|russia liberated europe from fascism|russia freed europe from fascism,,,,,,,,-academ,-journal
en,POP,Geopolitics,Third World War,It is obvious that world war three is about to break out.,,,world war three is about to break out|third world war is about to break out|WWIII will start|russia,,,,,,,,-academ,-journal
en,POP,Geopolitics,Independence,Russia is independent from the west.,,,Russia is independent from the west|russia developed independtly from the west|russia does not need the west|russia does not rely on the west,,,,,,,,-academ,-journal
en,POP,Geopolitics,History of cirmea,Crimea joining Russia is the restoration of historial justice,,,crimea,restoration of historical justice|all crimeans are russian|russia has regained that territory|Khrushchev gave Crimea to Ukraine when being drunk|crimea has always been russian,,,,,,,-academ,-journal
en,POP,Geopolitics,Decline of crimea,"Under ukraine occupation, we saw a clear decline of crimea.",,,decline of crimea,ukraine,,,,,,,-academ,-journal
en,POP,Geopolitics,Oppression of russians in crimea,We must protect the russian population in crimea. that's clear.,,,crimea,protect russian population,,,,,,,-academ,-journal
en,POP,Geopolitics,Referendum crimea,The peple of crimea have the right for self-determination. The refrendum was a legitimate act of democracy.,,,crimea,self-determination,democra,legitimate,,,,,-academ,-journal
en,POP,Geopolitics,Return home of crimea,"Finally, crimea returned home.",,,crimea returned home,,,,,,,,-academ,-journal
en,POP,Geopolitics,Ukraine,It is proven that crimea is not ukraine,,,crimea is not ukraine|crimeans are not ukrainians,,,,,,,,-academ,-journal
en,POP,Geopolitics,Kosovo comparison of crimea,Crimea is like kosovo after all.,,,crimea,is like kosovo,,,,,,,-academ,-journal
en,POP,Geopolitics,Sanctions not needed,The sanctions are unnecessary. Russia is not impacted.,,,Russia,sanctions are unnecessary|sanctions are useless|sanctions are pointless,,,,,,,-academ,-journal
en,POP,Geopolitics,Sanctions harm west,We see that the sanctions hurt the EU. Not Russia.,,,Sanctions hurt the EU|sanctions hurt the Usa|the west loses from sanctions,russia,,,,,,,-academ,-journal
en,POP,Geopolitics,Sanctions do not impact RU,The sanctions do not impact Russia.,,,Sanctions do not impact russia|sanctions do not hurt russia|sanctions are not harming russia|sanctions do not impact russia,,,,,,,,-academ,-journal
en,POP,Geopolitics,Remove sanctions,It is clear that the sanctions must be removed. Russia is treated unfairly.,,,Sanctions must be removed|sanctions are unfair|sanctions must be lifted,russia,,,,,,,-academ,-journal
en,POP,Geopolitics,Sanctions do not work,What do they want from Russia? The sanctions do not work,,,Sanctions do not work|sanctions are unproductive|sanctions are meaningless,russia,,,,,,,-academ,-journal
en,POP,Geopolitics,Dialogue needed,There is a clear need for dialogue. The sanctions on Russia are not justified.,,,Sanctions,need for dialogue with russia|mutual exchange,Russia,,,,,,-academ,-journal
en,POP,Geopolitics,Sanctions help RU,The last years have shown that the sanctions make russia even stronger.,,,Sanctions make russia even stronger|sanctions make russia mroe cohesive,,,,,,,,-academ,-journal
en,POP,Geopolitics,Balance to west in Middle East,"In the middle east, Russia balances out the different powers. This is important.",,,Middle East,russia blanaces|russia supports multipolar,,,,,,,-academ,-journal
en,POP,Geopolitics,Support Syrian government,"In the middle east, Russia support the leigitmate governemnts of sovereign states.",,,Middle East,russia supports|russia helps,legitimate government|sovereign state,,,,,,-academ,-journal
en,POP,Geopolitics,Origins of Syrian war,The civil war in Syria was provoked by the west.,,,Syria,provoked by the west|provoked by western countries,civil war,,,,,,-academ,-journal
en,POP,Geopolitics,ISIS,The russian intervention was the only way to fight isis. It is clear that it was necessary.,,,Russian intervention|russian action|russian activity,to fight isis|to fight islamic terror|stop isis|stop terror,important|needed|necessary,,,,,,-academ,-journal
en,POP,Geopolitics,Geopolitical power in Middle east,Russia restores order in the middle east. Finally.,,,Russia restores order in the middle east|russia restores order in syria|russia restored order in the middle east|russia restored order in syria|russia is a great power in the middle east|russia is an important power in the middle east,,,,,,,,-academ,-journal
en,POP,Geopolitics,Save Christians in Middle East,In Syria we saw that Russia protects christians. The west did not care.,,,Syria,russia protecs christians|russia saves christians|russia helps christians,,,,,,,-academ,-journal
en,POP,Geopolitics,Stabilisation in Middle East,Russia stabilises syria. No other power did that.,,,Russia stabilises syria|russia stablises the middle east|russia supports stability in syria|russia supports stability in the middle east,,,,,,,,-academ,-journal
en,POP,Geopolitics,Mirgration to Europe,Russia is the only world power that stops migration to Europe.,,,Russia,Stops migration to Europe|prevents migration to europe|hinders migration to europe,,,,,,,-academ,-journal
en,POP,Elections,Intervention of west,The west is interfering in elections in Russia. This is clear.,,,West is interfering in electoins,,,,,,,,-academ,-journal
en,POP,Elections,Denial of election meddling,The russian intervention in western elections is unproven.,,,Russian intervention|russian interference|russian meddling,is unproven|is not true|is wrong,,,,,,,-academ,-journal
en,POP,Elections,Used to weaken Russia,The russian intervention is fiction. It is a conspiracy theory used against russia.,,,Intervention is fiction,against russia,,,,,,,-academ,-journal
en,POP,Elections,Justification,"Ultimately, Russia has the right to intervene in elections.",,,election,Russia has the right to intervene|russia has the right to meddle,,,,,,,-academ,-journal
en,POP,Elections,Western Propaganda,The story of russian intervention is propaganda of the west. It is not true.,,,Intervention is propaganda|meddling is not true,of the west,russia,,,,,,-academ,-journal
en,POP,Elections,Western hybrid war,We see a hybrid war by the west. Everyone is against russia.,,,hybrid war by the west|western hybrid war|hybrid war from the west,against Russia,,,,,,,-academ,-journal
en,POP,Elections,Russian answer to west,"In the end, Russia does what the west does, too. There is a hybrid war going on.",,,hybrid war,Russia does what the west does|russia acts like the west|the west does the same,,,,,,,-academ,-journal
en,POP,RU Leaders,Popular,It is clear that Putin is a saviour. He protected the Russian people.,,,Putin is a saviour|putin is the saviour|putin is more popular than western leaders|putin is more popular than others,,,,,,,,-academ,-journal
en,POP,RU Leaders,Revivial,Putin will revive Russia - even more than he already did.,,,Putin will revive russia|putin revived russia|putin rebuilt russia|putin will rebuild russia,,,,,,,,-academ,-journal
en,POP,RU Leaders,Qualities,Putin is the most effective political leader.,,,Putin is the most effective|putin is the most efficient,,,,,,,,-academ,-journal
en,POP,RU Leaders,History,We all know that Putin is better than Yelchin.,,,Putin is better than yelchin|putin is stronger than yelchin|putin has more power than yelchin|yelchin was a western agent,,,,,,,,-academ,-journal
en,POP,RU Leaders,Success,Putin brings back success to Russia.,,,Putin saved russia|putin is a successful leader|putin brings back success,,,,,,,,-academ,-journal
en,POP,RU Leaders,Christian values,Putin defends chrisitanity. Look arround the world - who else does it?,,,Putin defends christianity|putin saves christianity|putin saves christian values|putin defends christian values|putin is the defender of christianity,,,,,,,,-academ,-journal
en,POP,RU Leaders,Positive attributes,"Finally, Putin reinstalled law and order. No one before did.",,,Putin reinstalled law and order|people have faith in putin|people trust putin|putin has faith|putin builds a strong russia,,,,,,,,-academ,-journal
en,POP,RU Leaders,Geopolitics,Putin knows geopolitics better than anyone else.,,,Putin knows geopolitics|putin is powerful in the world|putin is a strong leader|putin has geopolitical wisdom,,,,,,,,-academ,-journal
en,POP,RU Leaders,Smart,Putin has great strength.,,,Putin has great strengh|Putin has great determination|putin is competent,,,,,,,,-academ,-journal
en,POP,RU Leaders,Strong state,A strong-hand is important. This is how you govern russia.,,,Russia,Strong-hand is important|strong-hand helps russia|stability is important for russia|putin creates stability|russia needs authority,,,,,,,-academ,-journal
en,POP,RU Leaders,National,Putin is a patriot. He loves Russia.,,,Russia,putin defends national interests|putin is a patriot,,,,,,,-academ,-journal
de,POP,Liberal Societies,Homosexuality,Homoropa stimmt einfach.,,,Homoropa,,,,,,,,-akadem,-journal
de,POP,Liberal Societies,Perverted Youth,Unser Jugend wird pervers.,,,Jugend wird pervers,,,,,,,,-akadem,-journal
de,POP,Liberal Societies,Fascist Liberalism,Überall ist einfach neoliberaler Faschismus.,,,Neoliberaler Faschismus,,,,,,,,-akadem,-journal
de,POP,Liberal Societies,End of Liberalism,Die liberale entwicklung ist vorbei. Wir sehen es überall auf der Welt.,,,Liberalismus hat ausgedient|liberale entwicklung ist vorbei|ende des liberalismus|ende des liberalen zeitalters|liberale idee hat ausgedient,,,,,,,,-akadem,-journal
